ID,Category,Title,Content,Severity
13,Post Recovery,How might I guide my partner who is post recovery from alcoholism to deal with social situations where alcohol is present? ,"It's great to hear that your partner is in post-recovery from alcoholism, and it's understandable that navigating social situations where alcohol is present can be challenging. Here are some tips that might help guide your partner in handling such situations:

1. **Open Communication:** Encourage open communication with your partner about their feelings and concerns regarding social events involving alcohol. Understanding their triggers and anxieties can help you both come up with a plan together.

2. **Establish Boundaries:** Help your partner set clear boundaries for themselves, such as deciding in advance how long they will stay at an event, having a plan to leave if they feel uncomfortable, and identifying a supportive person to accompany them.

3. **Practice Self-Care:** Remind your partner about the importance of self-care in challenging situations. Encourage them to prioritize their well-being, whether it's taking breaks, deep breathing, or focusing on enjoyable activities unrelated to alcohol.

4. **Explore Alternatives:** Suggest finding alcohol-free social events or activities where they can still enjoy socializing without the presence of alcohol. This can help reduce temptation and create a supportive environment.

5. **Support System:** Encourage your partner to lean on their support system, whether it's attending meetings, connecting with a sponsor, or reaching out to friends or family members who understand their journey.

6. **Mindfulness and Coping Strategies:** Help your partner practice mindfulness techniques or coping strategies to manage cravings or stressful situations. Techniques like deep breathing, visualization, or grounding exercises can be helpful.

7. **Seek Professional Guidance:** If your partner is struggling significantly with social situations involving alcohol, suggest seeking guidance from a therapist or counselor specializing in addiction recovery. They can provide tailored strategies and support.

Do you have more information about your partner's specific concerns or challenges in social situations involving alcohol? Understanding the specific difficulties they face can help tailor the support and guidance you provide.",0
14,Post Recovery,What ways can I use to help my mother handle stressors that may lead to a potential relapse post-recovery from alcohol addiction? ,"It's great that you're looking to support your mother in her recovery journey. Here are some ways to help her handle stressors that might lead to a potential relapse:

1. Encourage Open Communication: Create a safe space where your mother can talk about her feelings and stressors without fear of judgment. Active listening can help her feel supported and understood.

2. Assist in Developing Healthy Coping Strategies: Help your mother identify healthy ways to cope with stress, such as exercise, mindfulness, journaling, or engaging in hobbies she enjoys.

3. Support Her in Seeking Professional Help: Encourage your mother to attend therapy sessions or support groups where she can learn additional coping skills and gain peer support.

4. Create a Structured Routine: Establishing a daily routine can provide stability and predictability, reducing the impact of stressors. Ensure she has time for self-care activities and relaxation.

5. Encourage Self-Care Practices: Emphasize the importance of prioritizing self-care, including adequate sleep, nutrition, exercise, and relaxation techniques.

6. Help Identify Triggers: Work together to recognize potential triggers that may lead to stress or cravings. By identifying these triggers, steps can be taken to avoid or manage them effectively.

7. Be a Source of Stability and Encouragement: Offer consistent support, understanding, and encouragement throughout her recovery journey. Remind her of the progress she has made and the strength she possesses.

In addition to these suggestions, it would be beneficial to understand more about your mother's specific situation. Can you provide more information about her current support system, any past experiences that have triggered stress or cravings, and any resources available to her post-recovery? This will help in tailoring the support and guidance more specifically to her needs.",0
15,Post Recovery,How can I empower my alcoholic-recovering daughter to establish new habits and routines? ,"It's wonderful to hear that you are looking to support your daughter in her recovery journey. Establishing new habits and routines is crucial in maintaining sobriety and preventing relapse. One effective way to empower her is by encouraging her to focus on self-care and make it a priority in her daily life. This includes ensuring she gets enough rest, eats well, exercises, and engages in activities that bring her joy and relaxation.

Additionally, cognitive therapy can be beneficial in helping her challenge negative thinking patterns that may lead to relapse. Mind-body relaxation techniques, such as mindfulness and meditation, can also help her manage stress and cravings. These tools are essential in developing healthy coping skills.

Encouraging her to actively participate in self-help groups like Alcoholics Anonymous (AA) can provide her with a supportive community, guidance, and shared experiences that can reinforce her commitment to recovery. Being honest with herself and others, asking for help when needed, and following the rules of recovery are all key components in her journey to establishing a new and fulfilling life.

Could you share more about your daughter's current routine and challenges she may be facing in her recovery process? This information will help tailor suggestions and support to better fit her specific needs.",0
16,Post Recovery,Can you suggest any types of therapies or meetings that would benefit my husband in his post recovery from alcohol addiction? ,"I appreciate your concern for your husband's well-being and his post-recovery journey from alcohol addiction. Based on the information you provided, it's great to hear that he's taking steps towards recovery.

For post-recovery support, therapies such as Cognitive Behavioral Therapy (CBT) can be beneficial in addressing negative thought patterns and behaviors associated with addiction. Additionally, Mindfulness-Based Relapse Prevention (MBRP) therapy has shown effectiveness in preventing relapse by promoting self-awareness and coping skills.

In terms of meetings, I would recommend Alcoholics Anonymous (AA) as it provides a supportive environment where individuals can share their experiences, strength, and hope with others who have faced similar challenges. Other options include SMART Recovery, which focuses on empowering individuals to manage addictive behaviors through self-empowerment and self-reliance.

It's important for your husband to find a support system that works best for him and aligns with his recovery goals. Would you like more information on how to approach this topic with your husband or how to provide support during his post-recovery journey?",0
17,Post Recovery,What resources can I provide to my alcoholic-recovering friend to comfort him during moments of craving? ,"I appreciate your concern for your friend's well-being. It's great that you're looking for ways to support them during moments of craving. Providing resources and comfort can make a significant difference in their recovery journey.

Here are some suggestions you can consider sharing with your friend:

1. Encourage them to reach out to their sponsor, counselor, or a trusted individual from their support group when experiencing cravings. Having someone to talk to can provide much-needed support.

2. Suggest engaging in mindfulness practices like deep breathing exercises, meditation, or yoga. These practices can help your friend stay grounded and calm during cravings.

3. Offer to participate in an activity with your friend that they enjoy and find distracting. This could be going for a walk, watching a movie, or playing a game.

4. Provide them with a list of helplines or crisis intervention services that they can reach out to in case of urgent need.

5. Share resources on relaxation techniques, such as progressive muscle relaxation or guided imagery, that can help your friend manage cravings effectively.

It's important to remind your friend that cravings are a natural part of the recovery process and that seeking help and utilizing coping mechanisms can make a difference. Additionally, understanding their triggers and having a plan in place to address cravings proactively can also be beneficial.

Can you share more about your friend's specific challenges during moments of craving? Understanding their triggers and thought patterns can help tailor the support and resources you provide.",0
18,Post Recovery,What kind of diet and lifestyle changes can I introduce to my son who is in his post-recovery phase from alcoholism?,"It's great to hear that your son is in the post-recovery phase from alcoholism, and it's wonderful that you are looking to support him through diet and lifestyle changes. A healthy diet and positive lifestyle adjustments can play a crucial role in maintaining sobriety and overall well-being.

Here are some suggestions on diet and lifestyle changes you can introduce to support your son during this phase:

1. **Nutritious Diet:** Encourage your son to eat a balanced diet rich in fruits, vegetables, whole grains, lean proteins, and healthy fats. Proper nutrition can help restore any nutrient deficiencies caused by alcohol abuse and support overall health.

2. **Stay Hydrated:** Encourage your son to stay well-hydrated by drinking plenty of water throughout the day. Dehydration can impact mood and energy levels, so it's important to maintain hydration.

3. **Regular Exercise:** Physical activity can help reduce stress, improve mood, and boost overall well-being. Encourage your son to engage in regular exercise such as walking, jogging, yoga, or any physical activity he enjoys.

4. **Healthy Coping Mechanisms:** Help your son find alternative coping mechanisms for stress or difficult emotions that don't involve alcohol. This could include mindfulness practices, hobbies, journaling, or talking to a therapist.

5. **Establish Routine:** Establishing a daily routine can provide structure and stability, which can be beneficial during recovery. Encourage your son to have a consistent sleep schedule, meal times, and activities.

6. **Avoid Triggers:** Help your son identify and avoid triggers that may lead to relapse. This could include certain social situations, places, or people that are associated with past drinking habits.

7. **Support System:** Encourage your son to maintain connections with supportive friends, family members, or a support group. Having a strong support system can be invaluable during the recovery process.

It's essential to have open and honest communication with your son about these changes and to support him in his journey toward continued sobriety and well-being. Encourage him to seek professional guidance if needed and to prioritize self-care and mental health.

If you have any specific concerns or questions about supporting your son during this phase, feel free to share more details so we can provide more tailored advice. How is your son responding to these changes so far?",0
19,Post Recovery,How can I help my wife who has recovered from alcoholism to build her self-confidence and self-esteem?,"It's wonderful to hear that your wife has recovered from alcoholism, and it's great that you want to support her in building her self-confidence and self-esteem. Recovery is a journey, and rebuilding self-confidence and self-esteem can be a key part of that journey.

Here are some ways you can help your wife in this process:

1. **Encouragement and Support**: Offer words of encouragement and support her efforts in recovery. Let her know that you believe in her and are there for her.

2. **Celebrate Achievements**: Acknowledge and celebrate her milestones and achievements, no matter how small they may seem. This can help boost her self-confidence.

3. **Promote Self-Care**: Encourage her to engage in activities that promote self-care, such as exercise, hobbies, meditation, or spending time with loved ones.

4. **Set Realistic Goals**: Help her set realistic and achievable goals. Success in reaching these goals can boost her self-esteem.

5. **Therapy and Counseling**: Suggest therapy or counseling to work on underlying issues that may be affecting her self-confidence and self-esteem. A mental health professional can provide valuable support and guidance.

6. **Mindfulness and Relaxation Techniques**: Encourage her to practice mindfulness or relaxation techniques to manage stress and promote a sense of well-being.

7. **Positive Affirmations**: Encourage her to practice positive affirmations to challenge negative self-talk and build a more positive self-image.

It's important to approach this process with patience, understanding, and empathy. Recovery is a journey with ups and downs, and your support can make a significant difference. Encourage open communication with your wife and let her know that you are there for her every step of the way.

If you feel comfortable sharing more specifics about your wife's journey and challenges, I can offer more tailored advice. How has your wife been feeling since her recovery? Are there specific areas where she struggles with self-confidence or self-esteem that you have noticed?",0
20,Post Recovery,Is there a way I can prepare myself to better assist my brother in his journey of post recovery from alcohol addiction? ,"It's wonderful that you want to support your brother in his post-recovery journey from alcohol addiction. Understanding the challenges individuals face during this time can help you provide effective support. Here are a few key points to keep in mind to assist your brother:

1. **Educate Yourself**: Learn about the recovery process, including potential triggers, stages of relapse, and coping mechanisms. This can help you understand what your brother may be going through.

2. **Encourage Open Communication**: Create a safe space for your brother to express his feelings and concerns. Listen without judgment and offer your support.

3. **Set Boundaries**: While supporting your brother, it's essential to set boundaries to protect yourself from being negatively impacted. Boundaries can involve maintaining your own well-being and not enabling destructive behaviors.

4. **Attend Support Meetings Together**: Offer to accompany your brother to support group meetings such as Alcoholics Anonymous (AA) if he is open to it. These meetings can provide valuable encouragement and guidance.

5. **Practice Self-Care**: Remember to take care of yourself too. Supporting a loved one through addiction recovery can be challenging, so ensure you have emotional support and time for self-care.

6. **Celebrate Milestones**: Acknowledge and celebrate your brother's successes and milestones in his recovery journey. Positive reinforcement can boost his motivation.

7. **Be Patient and Understanding**: Recovery is a process, and there may be setbacks along the way. Patience, empathy, and understanding can go a long way in supporting your brother through his ups and downs.

Would you like to share more about your brother's progress or any specific concerns you have? Understanding his current situation better can help tailor the support you provide.",0
21,Post Recovery,What should be my approach when my friend exhibits poor self-care during his post-recovery stage from alcohol addiction? ,"I'm glad you're reaching out for help on behalf of your friend. It's admirable that you want to support them in their recovery journey. When a friend exhibits poor self-care during the post-recovery stage from alcohol addiction, it's crucial to approach the situation with compassion and understanding.

Here are some steps you can consider taking to support your friend:

1. **Open Communication**: Talk openly and non-judgmentally with your friend about your observations regarding their self-care. Let them know you're there to support them.

2. **Encourage Professional Help**: Suggest seeking help from a therapist or counselor specialized in addiction recovery. They can provide valuable guidance and support.

3. **Support Group Participation**: Encourage your friend to actively engage in support groups like Alcoholics Anonymous (AA) or other recovery groups. These groups can offer valuable insights and camaraderie.

4. **Encourage Healthy Habits**: Help your friend develop healthy habits like exercising, maintaining a balanced diet, getting enough sleep, and practicing mindfulness or relaxation techniques.

5. **Set Boundaries**: Ensure you set boundaries to protect your own well-being while supporting your friend. It's essential to prioritize your mental and emotional health too.

6. **Educate Yourself**: Learn more about addiction and recovery to better understand what your friend is going through. This can help you provide more informed support.

Remember, supporting someone through addiction recovery can be challenging, but offering your understanding, patience, and encouragement can make a significant difference. Your friend is fortunate to have someone caring like you by their side.",0
22,Post Recovery,How can I support my sister who is dealing with post-acute withdrawal symptoms after recovering from alcoholism? ,"It's wonderful that you are seeking ways to support your sister during this challenging time. Dealing with post-acute withdrawal symptoms can be tough, but your support can make a significant difference in her recovery journey. Here are some ways you can support your sister:

1. **Encourage Professional Help:** Encourage your sister to seek continued support from healthcare professionals or support groups specialized in addiction recovery.

2. **Provide Emotional Support:** Be there to listen without judgment, offer words of encouragement, and provide a safe space for her to express her feelings.

3. **Support Healthy Habits:** Encourage healthy activities such as exercise, proper nutrition, and getting enough rest. These can help in managing withdrawal symptoms.

4. **Educate Yourself:** Learn more about post-acute withdrawal symptoms and recovery from alcoholism to better understand what your sister is going through.

5. **Set Boundaries:** While offering support, it's also essential to set boundaries to protect your own well-being. Ensure you are taking care of yourself too.

Would you like to share more about your sister's current situation? Understanding more about her specific struggles and needs can help tailor the support you provide her effectively. Feel free to share any additional details or concerns you may have.",0
23,Post Recovery,Can you suggest any mindfulness techniques that would benefit my alcoholic-recovering son to prevent relapse? ,"I appreciate your concern for your son and his recovery journey. Mindfulness techniques can indeed be very beneficial in preventing relapse by helping individuals stay present, manage stress, and cope with cravings. Here are some mindfulness practices you can suggest to your son:

1. **Deep Breathing:** Encourage your son to practice deep breathing exercises to help him stay calm and centered when faced with triggers or cravings.

2. **Body Scan Meditation:** This involves focusing on different parts of the body and noticing any tension or sensations. It can help your son become more aware of his physical state and release any built-up stress.

3. **Mindful Walking:** Suggest taking walks in nature and encouraging him to focus on the sights, sounds, and sensations around him. Walking mindfully can help clear the mind and reduce anxiety.

4. **Journaling:** Writing down thoughts, emotions, and triggers can be a form of mindfulness. It allows your son to reflect on his feelings and track patterns that may lead to relapse.

5. **Mindful Eating:** Encourage him to eat mindfully, savoring each bite, and paying attention to hunger and fullness cues. This can help bring awareness to his relationship with food and any emotional eating tendencies.

It's essential for your son to practice these techniques regularly and integrate them into his daily routine. Additionally, attending mindfulness-based relapse prevention programs or seeking guidance from a therapist trained in mindfulness practices can be very beneficial.

In light of your son's recovery journey, could you share a bit more about how he's currently coping with his sobriety and any specific challenges he may be facing? Understanding his unique situation can help tailor the support and strategies needed to aid in his recovery and relapse prevention efforts.",0
24,Post Recovery,What measures can I take as a family member to ensure my father remains disciplined in his post-recovery lifestyle from alcohol addiction?,"I appreciate your concern for your father's well-being. It's admirable that you are seeking ways to support him in maintaining his recovery from alcohol addiction. Here are some measures you can consider taking as a family member to help ensure his continued discipline in his post-recovery lifestyle:

1. **Encouragement and Emotional Support**: Offer consistent words of encouragement and emotional support to show your dad that you are there for him, no matter what challenges he may face.

2. **Open Communication**: Maintain open and honest communication with your father. Encourage him to share his thoughts and feelings with you, especially if he is struggling.

3. **Attend Support Meetings**: Consider attending support meetings such as Alcoholics Anonymous (AA) or family support groups with your father. This can show your commitment to his recovery and provide a sense of solidarity.

4. **Establish Healthy Boundaries**: Set healthy boundaries with your father regarding his recovery. Ensure that you express your support while also maintaining your own well-being.

5. **Educate Yourself**: Educate yourself about addiction, recovery, and relapse prevention. This knowledge will help you understand your father's journey better and provide more effective support.

6. **Encourage Healthy Lifestyle Choices**: Encourage your father to engage in healthy activities, such as exercise, hobbies, and socializing with supportive individuals. A healthy lifestyle can contribute to his overall well-being.

7. **Promote Mindfulness and Self-Care**: Encourage your father to practice mindfulness techniques and prioritize self-care to manage stress and prevent relapse.

8. **Celebrate Milestones**: Acknowledge and celebrate your father's progress and recovery milestones. Positive reinforcement can be motivating and empowering for him.

In supporting your father, it’s essential to also take care of yourself and seek guidance from professionals if needed. How is your father currently coping with his recovery journey? Have there been any specific challenges or successes he has experienced that you'd like to discuss further?",0
