ID,Category,Title,Content,Severity
0,Post Recovery,How can I assist my spouse in his journey of post recovery from alcoholism? ,"First of all, it's wonderful that you want to support your spouse in their journey of post-recovery from alcoholism. It's important to provide encouragement, understanding, and a stable environment for them as they navigate this challenging time. Here are some ways you can help your spouse:

1. **Encouragement and Support:** Let your spouse know that you are there for them, cheering them on every step of the way. Celebrate their successes, no matter how small they may seem, and provide a listening ear when they need to talk.

2. **Open Communication:** Have open and honest conversations about their recovery process. Ask them how you can best support them and what they need from you during this time.

3. **Setting Boundaries:** It's important to set boundaries to protect yourself as well. Make sure you establish healthy boundaries and stick to them. Encourage honesty and open communication while also taking care of your own well-being.

4. **Attend Support Meetings:** Consider attending support meetings together, such as Al-Anon or therapy sessions. This can provide both of you with valuable tools and a supportive community.

5. **Encourage Healthy Habits:** Help your spouse engage in activities that promote overall well-being such as exercise, healthy eating, and mindfulness practices.

6. **Educate Yourself:** Learn more about addiction, recovery, and relapse prevention to have a better understanding of what your spouse is going through.

7. **Celebrate Milestones:** Celebrate milestones in their recovery journey, whether it's a month of sobriety, attending a support group regularly, or any other achievement.

Remember, recovery is a journey, and there may be ups and downs along the way. Your continued love, support, and understanding can make a significant difference in your spouse's recovery. How is your spouse currently feeling post-recovery? Are they attending any support groups or receiving professional help?",0
1,Post Recovery,"What crucial steps can I take to ensure my sister, who just quit alcohol, does not relapse?","First of all, it's commendable that you want to support your sister in her journey to recovery. Here are some crucial steps you can take to help prevent relapse:

1. **Encourage Open Communication:** Create an environment where your sister feels comfortable discussing her feelings and struggles with you. Encouraging open communication can help her cope with challenges effectively.

2. **Support Her in Therapy:** If your sister is in therapy or support groups, offer to accompany her to sessions if she's comfortable with that. This shows your support for her recovery efforts.

3. **Identify Triggers:** Help your sister identify triggers that may lead to relapse, such as stress, certain places, or negative emotions. By recognizing these triggers, she can develop strategies to cope with them effectively.

4. **Promote Self-Care:** Encourage your sister to prioritize self-care activities like exercise, mindfulness, proper nutrition, and adequate sleep. Taking care of her overall well-being can help reduce the risk of relapse.

5. **Create a Supportive Environment:** Remove any alcohol or triggers from your shared spaces, and surround her with a supportive and understanding network of friends and family.

6. **Educate Yourself:** Learn more about addiction, recovery, and relapse prevention. Understanding the challenges she may face can help you provide better support.

It's also important to remember that relapse can happen, and it doesn't mean failure. If your sister does relapse, continue to offer your support, understanding, and encouragement to help her get back on track. Remember to take care of yourself too, as supporting a loved one through addiction recovery can be emotionally challenging. How is your sister coping with her decision to quit alcohol? Have you noticed any warning signs or triggers that you are concerned about?",0
2,Post Recovery,What are some useful approaches I can employ to help my father cope with his post-recovery phase from alcoholism? ,"It's wonderful that you want to support your father during his post-recovery phase from alcoholism. It's important to remember that this can be a challenging time for him as he adjusts to living a sober life. Here are some approaches you can consider to help him cope effectively:

1. Encourage Him to Stay Connected: Support groups like Alcoholics Anonymous can be incredibly beneficial for individuals in recovery. Encourage your father to continue attending meetings or seek out other forms of support if he feels comfortable.

2. Promote Healthy Lifestyle Choices: Encourage your father to prioritize self-care by adopting healthy habits such as regular exercise, balanced nutrition, and sufficient sleep. Physical well-being can greatly impact mental and emotional health.

3. Foster Open Communication: Create a safe space for your father to openly discuss his thoughts, feelings, and struggles without judgment. Effective communication can help him navigate challenges more effectively.

4. Provide Emotional Support: Let your father know that you are there for him, no matter what. Offer words of encouragement, understanding, and empathy to help him feel supported along his journey.

5. Set Boundaries: While it's important to support your father, it's also crucial to set boundaries to protect your own well-being. Ensure that you take care of yourself so you can continue providing effective support.

It's great that you are seeking ways to help your father during this critical time. Could you provide more information about how your father is currently coping with his recovery? Understanding his specific challenges and progress can help tailor the support you offer to his unique needs.",0
3,Post Recovery,What kind of support does a person in post-recovery from alcoholism typically need from their family members? ,"It's wonderful that you're seeking information on how to support your loved one in post-recovery from alcoholism. Family support plays a crucial role in an individual's recovery journey. Here are some ways you can support a person in post-recovery from alcoholism:

1. **Encouragement and Positive Reinforcement**: Celebrate their milestones and achievements in their recovery journey to boost their confidence.

2. **Open Communication**: Foster open and honest communication. Listen actively and empathetically to their thoughts and feelings without judgment.

3. **Setting Healthy Boundaries**: Encourage healthy boundaries to protect both your loved one and yourself. Establishing boundaries can prevent enabling behaviors.

4. **Educate Yourself**: Learn more about alcoholism, recovery, and relapse prevention. Understanding the challenges they face can help you support them better.

5. **Attend Support Meetings**: Consider attending family support groups like Al-Anon, Nar-Anon, or therapy sessions to receive guidance and connect with others in similar situations.

6. **Provide a Supportive Environment**: Create a supportive and stable environment at home. Remove triggers or substances that may tempt them to relapse.

7. **Avoid Enabling**: Refrain from enabling behaviors like covering up for mistakes or providing monetary support that may hinder their recovery progress.

8. **Encourage Healthy Habits**: Support their efforts to maintain a healthy lifestyle by engaging in activities that promote well-being, such as exercise, mindfulness, and hobbies.

9. **Be Patient and Understanding**: Recovery is a journey with ups and downs. Practice patience and show understanding during challenging times.

10. **Celebrate Sobriety**: Recognize and celebrate their commitment to sobriety. Express your pride in their efforts and offer ongoing encouragement.

It's important to remember that each individual's recovery needs may vary, so it's beneficial to have open conversations with them about how you can best support their specific journey. How is your loved one currently coping with their recovery, and what kind of support have they expressed they need from you?",0
4,Post Recovery,How can I help my cousin to prevent a relapse after his recovery from alcohol addiction? ,"It's wonderful that you want to support your cousin in preventing a relapse after recovering from alcohol addiction. One of the crucial aspects of relapse prevention is creating a supportive environment and helping your cousin develop healthy coping mechanisms. Here are some suggestions based on the information provided:

1. Encourage your cousin to focus on creating a new life where it's easier not to use alcohol. Help them identify triggers and situations that may lead to relapse and find healthier alternatives.

2. Support your cousin in practicing complete honesty, especially within their support system or recovery circle. Being open about struggles and emotions can help prevent relapse.

3. Encourage your cousin to ask for help when needed. This could involve attending self-help groups like Alcoholics Anonymous, having a sponsor, or seeking professional guidance when facing challenges.

4. Emphasize the importance of self-care in your cousin's recovery journey. Help them prioritize physical, emotional, and psychological well-being, including relaxation techniques like mindfulness and stress management.

5. Remind your cousin not to bend the rules of recovery. Encourage them to follow the guidelines and coping strategies they have learned during their recovery process.

Additionally, you can offer your cousin emotional support, listen without judgment, and be a source of encouragement throughout their recovery. It's essential to keep the lines of communication open and let your cousin know that you are there for them.

Can you provide more insight into your cousin's current support system, daily routines, and any challenges they may be facing post-recovery? Understanding their specific situation can help tailor the support you offer to best assist them in maintaining their sobriety.",0
5,Post Recovery,Can you recommend daily routine changes that will help my friend in his post-recovery phase from alcohol abuse? ,"I appreciate your concern for your friend's well-being as they navigate the post-recovery phase from alcohol abuse. Establishing a healthy daily routine can indeed support their recovery journey. Here are some routine changes that may be beneficial for your friend:

1. **Structured Schedule**: Encourage your friend to establish a consistent daily routine with set wake-up times, meal schedules, and designated times for activities, work, and relaxation.

2. **Physical Activity**: Incorporating regular exercise into their routine can help boost mood, reduce stress, and improve overall well-being. Activities like walking, yoga, or swimming can be beneficial.

3. **Mindfulness Practices**: Practicing mindfulness techniques like meditation or deep breathing exercises can aid in managing stress and promoting inner calmness.

4. **Healthy Diet**: Encourage your friend to focus on a balanced diet with nutritious foods that support their physical and mental health. Staying hydrated is also essential.

5. **Support Groups**: Regular participation in support groups like Alcoholics Anonymous can provide ongoing encouragement, accountability, and a sense of community.

6. **Hobbies and Interests**: Encourage your friend to engage in activities they enjoy, such as hobbies, sports, or creative pursuits, to foster a sense of fulfillment and purpose.

7. **Self-Care Practices**: Encourage your friend to prioritize self-care activities like adequate sleep, relaxation techniques, and engaging in activities that bring them joy and relaxation.

It's crucial for your friend to tailor their routine to their individual needs and preferences. Would you like to share more about your friend's preferences and challenges so we can explore more personalized suggestions to support their post-recovery phase effectively?",0
7,Post Recovery,What are the common challenges that my brother might face in his post recovery from alcoholism and how can I assist him? ,"It's great that you're looking to support your brother in his post-recovery journey from alcoholism. Common challenges that individuals may face after recovery include dealing with triggers that may tempt them to relapse, managing stress and negative emotions, rebuilding relationships, finding ways to have fun without alcohol, and maintaining a sense of purpose and fulfillment in life.

To assist your brother, you can provide him with a supportive and understanding environment, encourage him to attend support groups or therapy sessions, help him identify and avoid triggers, engage in healthy activities together, and celebrate his milestones and achievements in recovery. It's also important to educate yourself about alcoholism and recovery to better understand what he may be going through.

Could you provide more information about your brother's current support system and coping mechanisms? This can help in tailoring more specific ways to assist him on his post-recovery journey.",0
6,Post Recovery,What steps can I take to help my partner manage triggers that might tempt him to drink again after sobriety? ,"It's wonderful that you are seeking ways to support your partner in managing triggers that could potentially lead to a relapse. One crucial first step is open communication with your partner about their triggers and what support they need from you. Here are some steps you can take to help your partner manage triggers and maintain their sobriety:

1. Encourage Open Communication: Create a safe and supportive environment where your partner feels comfortable discussing their triggers, cravings, and challenges with you. Listen actively and without judgment.

2. Identify Triggers Together: Work with your partner to identify specific triggers that may lead to cravings or thoughts of relapse. These triggers can be emotional, environmental, or social situations that prompt the desire to drink.

3. Develop Coping Strategies: Help your partner develop healthy coping mechanisms to deal with triggers when they arise. This could include deep breathing exercises, distraction techniques, seeking support from a sponsor or therapist, or engaging in a favorite hobby.

4. Create a Supportive Environment: Encourage a healthy lifestyle by promoting regular exercise, nutritious meals, and adequate sleep. A stable and positive environment can help reduce stress and minimize the impact of triggers.

5. Attend Support Meetings Together: If your partner is part of a support group like Alcoholics Anonymous, offer to attend meetings together or participate in counseling sessions if they feel comfortable. Your presence can provide additional encouragement and support.

6. Celebrate Milestones: Acknowledge and celebrate your partner's progress and achievements in sobriety. Positive reinforcement can boost their confidence and motivation to stay on track.

7. Seek Professional Help: If your partner is struggling with managing triggers and maintaining sobriety, encourage them to seek help from a therapist or counselor specialized in addiction recovery.

Remember, supporting a loved one through addiction recovery can be challenging, so it's important to also take care of yourself and set healthy boundaries. How does your partner currently cope with triggers, and have they identified any specific strategies that work well for them?",0
8,Post Recovery,How can I approach conversations about alcohol with my spouse who is in her post-recovery phase? ,"It's commendable that you are looking for ways to support your spouse during her post-recovery phase. Approaching conversations about alcohol with sensitivity and understanding is crucial in such situations. Here are some tips on how to navigate these conversations:

1. **Choose the Right Time and Place**: Find a time when both of you are relaxed and have privacy. Avoid discussing such matters when either of you is tired, stressed, or in a hurry.

2. **Use ""I"" Statements**: Express your concerns using ""I"" statements to avoid sounding accusatory. For example, say, ""I feel worried when I notice certain behaviors"" instead of ""You are doing this wrong.""

3. **Listen Actively**: Encourage your spouse to share their thoughts and feelings regarding alcohol. Listen without judgment and offer your support empathetically.

4. **Acknowledge the Progress**: Recognize the efforts your spouse has made to maintain sobriety. Appreciating their journey can boost their confidence and morale.

5. **Discuss Triggers and Coping Strategies**: Have an open dialogue about potential triggers that may lead to relapse and brainstorm healthy coping mechanisms together.

6. **Offer Your Support**: Let your spouse know that you are there for them, whether it's attending support group meetings together or seeking professional help if needed.

7. **Set Boundaries**: Establish clear boundaries around alcohol use within your household to create a supportive environment for your spouse's recovery.

8. **Educate Yourself**: Learn more about addiction, recovery, and relapse prevention to have a deeper understanding of what your spouse is going through.

Approaching these conversations with love, empathy, and patience is essential. Remember, being a supportive and understanding partner can make a significant difference in your spouse's recovery journey. How has your spouse's recovery been progressing so far? Do you notice any specific behaviors or triggers that concern you?",0
9,Post Recovery,What crucial milestones should I look for in my son's post-recovery journey from alcoholism? ,"It's wonderful that you're attentive to your son's post-recovery journey from alcoholism. In the post-recovery phase, here are some crucial milestones to look out for to ensure continued progress:

1. **Abstinence Maintenance:** One key milestone is sustaining abstinence from alcohol over time.
2. **Repairing Relationships:** Progress in repairing damaged relationships and making amends where necessary.
3. **Improved Self-Care:** Development of healthier self-care habits and prioritizing emotional, physical, and psychological well-being.
4. **Increased Coping Skills:** Building and utilizing effective coping mechanisms to manage stress, triggers, and cravings.
5. **Engagement in Support Groups:** Active participation in support groups like AA or other recovery communities for ongoing encouragement.
6. **Finding Purpose:** Discovering new interests, goals, and sources of fulfillment beyond alcohol.
7. **Positive Lifestyle Changes:** Embracing a balanced and healthier lifestyle, including diet, exercise, and hobbies.
8. **Emotional Growth:** Demonstrating emotional growth, self-awareness, and resilience in facing challenges.

As your son progresses through these milestones, it's important to offer your support, understanding, and encouragement. Celebrate his achievements, offer help when needed, and be patient with setbacks. Additionally, ensure open communication to understand his needs and feelings throughout this journey.

Is your son currently engaging in any post-recovery programs or therapies? How do you feel about your role in supporting him during this phase?",0
10,Post Recovery,How can I create a supportive environment at home for my wife who is in her post-recovery stage from alcohol addiction? ,"It's wonderful that you're seeking ways to support your wife in her post-recovery stage from alcohol addiction. Creating a supportive environment is crucial for her continued success. Here are some tips to help you achieve that:

1. **Open Communication:** Encourage open and honest communication. Let her know that you're there to listen without judgment.

2. **Healthy Boundaries:** Establish healthy boundaries that promote her sobriety. This may include avoiding triggers like keeping alcohol out of the house.

3. **Encouragement:** Offer words of encouragement and praise her progress. Celebrate the milestones, no matter how small they may seem.

4. **Self-Care:** Encourage her to prioritize self-care, which includes adequate rest, nutrition, exercise, and time for relaxation.

5. **Support Groups:** Encourage her to continue attending support groups or meetings that reinforce her commitment to sobriety.

6. **Seek Professional Help:** If needed, consider seeking the help of a therapist or counselor who specializes in addiction recovery to provide additional support.

Do you feel that your wife is comfortable discussing her struggles and progress with you? How has her journey been so far, and are there any specific challenges that you've noticed during her post-recovery stage?",0
12,Post Recovery,How can I help my brother develop healthier coping mechanisms post recovery from alcoholism? ,"It's wonderful that you want to support your brother in developing healthier coping mechanisms post-recovery from alcoholism. Encouraging him to engage in cognitive therapy and mind-body relaxation techniques can be beneficial. Additionally, attending support groups like Alcoholics Anonymous or engaging in mindfulness-based practices can aid in coping with triggers and stress.

It's important to create a supportive environment for your brother, where honesty and open communication are encouraged. Encourage him to prioritize self-care, such as regular exercise, proper nutrition, and sufficient rest. Setting boundaries and being available to listen without judgment can also be extremely helpful.

Have you noticed any specific challenges or triggers that your brother encounters in his recovery journey? Understanding his unique situation and needs can guide you in providing effective support.",0
11,Post Recovery,What activities can I introduce to my friend who is recovering from alcoholism to fill the void left by alcohol? ,"It's wonderful that you want to support your friend in their recovery journey from alcoholism. Introducing new activities can be a great way to help them find healthy outlets and fill the void left by alcohol. Here are some activities that may help your friend in their recovery:

1. **Exercise:** Physical activity can help boost mood and reduce stress. You can suggest activities like walking, jogging, yoga, or joining a gym.

2. **Art or Music:** Creative outlets like painting, drawing, playing a musical instrument, or listening to music can be therapeutic and enjoyable.

3. **Mindfulness or Meditation:** Practicing mindfulness or meditation can help your friend stay present and manage stress effectively.

4. **Volunteering:** Getting involved in volunteer work or community service can bring a sense of fulfillment and purpose.

5. **Learning New Skills:** Encouraging your friend to take up a new hobby or learn something new can be mentally stimulating and rewarding.

6. **Social Activities:** Organizing game nights, movie nights, or outings with friends who support their recovery can provide social connection without the need for alcohol.

7. **Nature Activities:** Spending time in nature, going for hikes, or gardening can be relaxing and grounding.

It's important to remember that everyone is different, so it's essential to support your friend in exploring activities that align with their interests and bring them joy. Additionally, being a supportive and understanding presence for your friend as they navigate their recovery journey is crucial. 

Can you provide more information about your friend's interests or any specific challenges they are facing in their recovery? This can help in suggesting personalized activities that may be more beneficial for them.",0
